category,text
technology,Artificial intelligence is reshaping the future of technology with its innovative applications.
sports,The team's victory in the championship game was celebrated with a parade through the city streets.
entertainment,The film industry is buzzing with excitement over the release of highly anticipated sequels.
health,Healthy living involves making conscious choices to prioritize physical and mental well-being.
politics,Political debates often spark heated discussions about the direction of government policies.
technology,The rapid pace of technological advancement presents both opportunities and challenges.
sports,Athletes train rigorously to achieve peak performance and excel in their chosen sport.
entertainment,Celebrities often use social media platforms to engage with fans and promote their projects.
health,Proper nutrition and regular exercise are essential for maintaining a healthy lifestyle.
politics,Elections provide citizens with the opportunity to voice their opinions and influence governance.
technology,Innovations in renewable energy are crucial for addressing environmental sustainability.
sports,Fans eagerly await the start of the new season to cheer on their favorite teams.
entertainment,Theater productions bring stories to life on stage captivating audiences with their performances.
health,Medical research continues to advance our understanding of diseases and treatment options.
politics,Government officials face scrutiny from the media and public over their decision-making.
technology,The rise of automation is transforming industries and reshaping the future of work.
sports,Teamwork and dedication are key factors in achieving success in competitive sports.
entertainment,Streaming services offer a wide range of content for viewers to enjoy at their convenience.
health,Mental health awareness campaigns aim to reduce stigma and promote access to support services.
politics,Policy debates often center around issues such as healthcare, education, and economic reform.
technology,The Internet of Things connects devices and enables smart solutions for everyday tasks.
sports,Professional athletes serve as role models for aspiring young athletes in their communities.
entertainment,Music festivals attract crowds of fans who gather to enjoy live performances by their favorite artists.
health,Regular sleep patterns and stress management techniques contribute to overall well-being.
politics,Legislative sessions involve deliberations on bills and proposals to enact new laws or policies.
technology,Virtual reality technology immerses users in simulated environments for entertainment and training.
sports,The Olympic Games showcase the world's top athletes competing on the global stage.
entertainment,Television shows and movies provide escapism and entertainment for audiences worldwide.
health,Dietary supplements can complement a balanced diet and support overall health goals.
politics,International diplomacy plays a crucial role in maintaining peace and resolving conflicts.
technology,Blockchain technology offers decentralized solutions for secure transactions and data management.
sports,Fans demonstrate unwavering loyalty and passion for their favorite teams, rain or shine.
entertainment,Cultural events celebrate diversity and promote artistic expression within communities.
health,Preventive care measures such as vaccinations and screenings help detect and prevent illnesses.
politics,Political campaigns rely on effective communication strategies to reach voters and convey messages.
technology,The advent of 5G technology promises faster and more reliable wireless connectivity.
sports,Athletes overcome adversity and setbacks through resilience and determination.
entertainment,The red carpet at awards shows is a showcase of glamorous fashion and celebrity style.
health,Mental health professionals provide therapy and support to individuals experiencing emotional distress.
politics,Government officials face public scrutiny and accountability for their actions and decisions.
technology,The tech industry thrives on innovation and disruption, driving progress and change.
sports,Spectators cheer and chant in unison to rally support for their team during games.
entertainment,Live performances by musicians and artists create unforgettable experiences for audiences.
health,Self-care practices such as meditation and mindfulness promote emotional well-being.
politics,Debates over public policy often center around ideological differences and priorities.
technology,Artificial intelligence algorithms analyze vast amounts of data to extract insights and patterns.
sports,Coaches play a critical role in guiding and mentoring athletes to reach their full potential.
entertainment,Hollywood blockbusters captivate audiences with thrilling action sequences and special effects.
health,Nutrition labels provide valuable information about the contents of packaged food products.
politics,Voter turnout is a key indicator of public engagement and participation in democratic processes.
technology,The Internet enables global connectivity and facilitates communication across borders.
sports,Professional athletes dedicate countless hours to training and preparation for competitions.
entertainment,Movie trailers generate buzz and anticipation for upcoming releases among moviegoers.
health,Regular physical activity boosts mood and energy levels while reducing the risk of chronic diseases.
politics,Political parties mobilize supporters and volunteers to canvass neighborhoods and rally voters.
technology,Cloud computing services offer scalable and cost-effective solutions for businesses of all sizes.
sports,Team chemistry and camaraderie are essential for success in team sports.
entertainment,Creative collaborations between artists result in groundbreaking works of art and music.
health,Public health initiatives promote healthy behaviors and lifestyles to improve overall well-being.
politics,Government transparency and accountability are essential for maintaining public trust.
technology,Machine learning algorithms analyze data to make predictions and automate decision-making.
sports,The roar of the crowd creates an electrifying atmosphere at sporting events.
entertainment,Cinematic universes expand storytelling possibilities across multiple interconnected films.
health,Regular exercise boosts immune function and reduces the risk of infections and illnesses.
politics,Policy debates shape the direction of government action and influence public policy outcomes.
technology,Robotics and automation are revolutionizing industries and transforming the workforce.
sports,Athletes demonstrate sportsmanship and respect for their opponents on and off the field.
entertainment,Art exhibits showcase the creativity and talent of artists from diverse backgrounds.
health,Healthy aging involves adopting lifestyle habits that support physical and cognitive health.
politics,Campaign ads inundate airwaves and social media platforms during election seasons.
technology,Quantum computing holds the potential to solve complex problems beyond the reach of classical computers.
sports,Fans display team colors and logos to show allegiance and pride for their favorite teams.
entertainment,Streaming platforms offer a vast library of content for binge-watching enthusiasts.
health,Medical breakthroughs offer hope for patients with rare diseases and conditions.
politics,Political debates highlight competing visions for the future and policy priorities.
technology,The Internet revolutionized how information is accessed, shared, and consumed.
sports,Victory celebrations erupt as the winning team hoists the championship trophy.
entertainment,Blockbuster movies draw massive crowds to theaters for opening weekend premieres.
health,Healthy eating habits begin with mindful choices and portion control.
politics,Policy decisions have far-reaching consequences for communities and future generations.
technology,Augmented reality enhances user experiences by overlaying digital content onto the physical world.
sports,Team rivalries intensify the competitive spirit and drive athletes to excel.
entertainment,Live performances showcase the talent and charisma of musicians and entertainers.
health,Regular physical activity is linked to improved cardiovascular health and longevity.
politics,Political candidates campaign tirelessly to garner support and win over undecided voters.
technology,The Internet of Things connects devices and enables smart solutions for homes and businesses.
sports,Training regimens focus on building strength, speed, and endurance for peak athletic performance.
entertainment,Pop culture trends influence fashion, music, and entertainment preferences.
health,Mental health resources provide support and guidance to individuals struggling with mental illness.
politics,Public opinion polls gauge public sentiment and influence political strategies.
technology,Cybersecurity measures protect digital assets and safeguard against cyber threats.
sports,Records are shattered and new milestones achieved in the pursuit of excellence in sports.
entertainment,Live events bring people together to share experiences and create lasting memories.
health,Healthy habits formed in childhood lay the foundation for lifelong well-being.
politics,Political pundits analyze election results and speculate on their implications.
technology,Artificial intelligence algorithms power virtual assistants and personalized recommendations.
sports,Fans flock to stadiums and arenas to witness thrilling sports matchups live.
entertainment,Streaming services offer a vast array of content for viewers to binge-watch at their leisure.
health,Regular exercise is associated with improved mood and mental health outcomes.
politics,Government officials face pressure to address pressing issues and deliver on campaign promises.
technology,The digital revolution has transformed how we live, work, and interact with one another.
sports,Team captains inspire and motivate their teammates to perform at their best.
entertainment,The entertainment industry is constantly evolving to adapt to changing consumer preferences.
health,Healthy sleep habits are essential for cognitive function and overall well-being.
politics,Political campaigns rely on fundraising efforts to finance advertising and outreach initiatives.
technology,The rise of social media platforms has revolutionized communication and networking.
sports,Fan loyalty spans generations, with families passing down support for their favorite teams.
entertainment,Hollywood premieres attract A-list celebrities and media attention from around the world.
health,Preventive screenings and check-ups are crucial for early detection of health problems.
politics,Public opinion polls provide insights into voter preferences and sentiment.
technology,Innovations in biotechnology hold promise for breakthroughs in healthcare and agriculture.
sports,Coaches develop game strategies and tactics to outsmart opponents and secure victories.
entertainment,Live performances captivate audiences with dazzling choreography and stunning visuals.
health,Healthy aging involves maintaining an active lifestyle and engaging in social activities.
politics,Political analysts dissect speeches and policy proposals to uncover underlying motives.
technology,Cutting-edge research pushes the boundaries of what is possible in science and technology.
sports,Fan communities rally behind their teams with unwavering support and dedication.
entertainment,Red carpet events showcase glamorous fashion and celebrity culture on a global stage.
health,Medical advancements offer hope for patients battling life-threatening illnesses.
politics,Policy debates highlight ideological differences and competing visions for the future.
technology,Artificial intelligence applications are transforming industries and reshaping society.
sports,Team chemistry and camaraderie are crucial for success in team sports competitions.
entertainment,Music festivals attract crowds of music enthusiasts from all walks of life.
health,Dietary choices impact overall health and well-being, influencing disease risk and longevity.
politics,Election campaigns mobilize volunteers and activists to canvass neighborhoods and rally voters.
technology,The Internet of Things connects devices and enables seamless communication and automation.
sports,Athletes train tirelessly to hone their skills and prepare for the challenges of competition.
entertainment,Movie premieres draw celebrities and fans alike to theaters for exclusive screenings.
health,Preventive care measures such as vaccinations and screenings are essential for public health.
politics,Political leaders make tough decisions that impact the lives of citizens and future generations.
technology,The tech industry drives innovation and economic growth, shaping the world we live in.
sports,Fans flock to stadiums and arenas to cheer on their favorite teams and athletes.
entertainment,Television shows and movies provide entertainment and escapism for audiences worldwide.
health,Physical activity is linked to improved cardiovascular health and reduced risk of chronic diseases.
politics,Political campaigns mobilize volunteers and resources to support candidates and causes.
technology,The Internet connects people and information across the globe, fostering communication and collaboration.
sports,Teamwork and determination are essential for success in competitive sports.
entertainment,Theater productions transport audiences
entertainment,The film was a masterpiece, captivating audiences with its brilliant storytelling and compelling characters.
health,Regular exercise is essential for maintaining a healthy lifestyle and reducing the risk of chronic diseases.
technology,Artificial intelligence is rapidly advancing, revolutionizing various industries and enhancing productivity.
politics,Political leaders must prioritize the needs of their constituents and work towards creating a more equitable society.
sports,The championship game was a thrilling spectacle, showcasing the incredible talent and determination of the athletes.
entertainment,Music has the power to evoke emotions and create connections across cultures and generations.
health,A balanced diet rich in fruits, vegetables, and whole grains is key to promoting overall well-being and longevity.
technology,Innovation drives progress, leading to breakthroughs that shape the future of technology and society.
politics,Democracy relies on active citizen participation and informed decision-making to ensure accountability and representation.
sports,Teamwork and dedication are crucial for achieving success in competitive sports and overcoming adversity.
entertainment,Theater productions transport audiences to new worlds, sparking imagination and inspiring creativity.
health,Mental health is just as important as physical health, and seeking support is a sign of strength, not weakness.
technology,The internet has transformed how we communicate, connect, and access information, opening up endless possibilities.
politics,Effective governance requires collaboration and compromise to address complex challenges and serve the common good.
sports,Athletes serve as role models for perseverance, sportsmanship, and dedication to excellence on and off the field.
entertainment,Artistic expression enriches our lives, offering a window into different perspectives and experiences.
health,Preventive care and early detection are crucial for preventing diseases and improving health outcomes.
technology,The rise of automation and robotics is reshaping industries and workforce dynamics, creating new opportunities and challenges.
politics,Transparency, accountability, and integrity are fundamental principles of good governance and public trust.
sports,The Olympic Games unite nations in friendly competition, promoting peace, solidarity, and mutual respect.
entertainment,Books transport readers to far-off lands and imaginary worlds, fostering empathy and understanding.
health,Self-care practices such as mindfulness, meditation, and relaxation techniques can help manage stress and promote mental well-being.
technology,Blockchain technology has the potential to revolutionize industries by enhancing security, transparency, and efficiency.
politics,Political polarization and division hinder progress and undermine democratic values, requiring dialogue and cooperation to bridge divides.
sports,The thrill of victory and the agony of defeat are part of the emotional rollercoaster of competitive sports.
entertainment,Artists push boundaries, challenge norms, and provoke thought through their creative expression.
health,Sleep is essential for physical and mental health, enabling the body to rest, repair, and recharge.
technology,The future of transportation is electric, autonomous, and interconnected, reducing emissions and congestion.
politics,Ensuring access to education, healthcare, and economic opportunities is essential for achieving social justice and equality.
sports,Injuries are an unfortunate but inevitable part of sports, highlighting the importance of safety measures and proper training.
entertainment,Television shows and films provide escapism, entertainment, and cultural commentary, shaping popular culture.
health,Nutrition education empowers individuals to make informed choices about their diets and improve their overall health.
technology,The Internet of Things (IoT) connects devices and systems, enabling smart, data-driven solutions for various applications.
politics,Civic engagement is essential for democracy, as informed and active citizens hold leaders accountable and drive change.
sports,The thrill of competition and the camaraderie of teammates make sports a universal language that transcends barriers.
entertainment,The power of storytelling lies in its ability to inspire, educate, and evoke empathy in audiences.
health,Physical activity is essential for maintaining muscle strength, bone density, and cardiovascular health.
technology,Virtual reality (VR) and augmented reality (AR) offer immersive experiences that blur the line between the digital and physical worlds.
politics,Protecting civil liberties and human rights is paramount in upholding democratic values and fostering social cohesion.
sports,The adrenaline rush of extreme sports challenges athletes to push their limits and defy gravity.
entertainment,Music festivals bring people together to celebrate diversity, culture, and the universal language of music.
health,Mental health stigma persists, but education and awareness efforts are breaking down barriers and promoting acceptance.
technology,5G technology promises ultra-fast speeds, low latency, and connectivity for a wide range of applications and devices.
politics,Global cooperation is essential for addressing pressing issues such as climate change, pandemics, and economic inequality.
sports,The spirit of sportsmanship emphasizes fair play, respect for opponents, and graciousness in victory and defeat.
entertainment,Art reflects society, challenging norms, provoking thought, and sparking dialogue about important issues.
health,Chronic stress can negatively impact physical and mental health, leading to conditions such as anxiety, depression, and heart disease.
technology,Machine learning algorithms analyze vast amounts of data to extract insights and make predictions in various fields.
politics,Protecting democratic institutions and norms is vital for safeguarding the rule of law, freedom of expression, and human rights.
sports,Paralympic athletes inspire the world with their resilience, determination, and extraordinary achievements.
entertainment,Live performances create memorable experiences, fostering connections between performers and audiences.
health,Preventive measures such as vaccinations, screenings, and regular check-ups are essential for disease prevention and early detection.
technology,Cybersecurity threats pose significant risks to individuals, businesses, and governments, highlighting the importance of robust defense measures.
politics,Effective leadership requires empathy, integrity, and a commitment to serving the public interest.
sports,The pursuit of excellence drives athletes to train tirelessly, overcome obstacles, and strive for greatness.
entertainment,Artistic expression encompasses a wide range of forms, from painting and sculpture to dance and theater.
health,Healthy eating habits start with education and awareness about nutrition, food choices, and portion control.
technology,Artificial intelligence (AI) applications range from virtual assistants and chatbots to autonomous vehicles and medical diagnostics.
politics,Participatory democracy empowers citizens to shape policies and decisions that affect their lives and communities.
sports,The joy of sports lies in the camaraderie of teammates, the thrill of competition, and the satisfaction of personal achievement.
entertainment,Film festivals showcase diverse voices, cultures, and perspectives, promoting inclusivity and understanding.
health,The mind-body connection is powerful, with mental health influencing physical well-being and vice versa.
technology,Quantum computing holds the promise of solving complex problems exponentially faster than classical computers.
politics,Political apathy undermines democracy, as citizen engagement and participation are essential for a healthy society.
sports,Sports bring people together, fostering friendships, promoting teamwork, and building community spirit.
entertainment,The performing arts provide a platform for self-expression, creativity, and storytelling.
health,Preventive health measures, such as exercise, nutrition, and stress management, are key components of holistic well-being.
technology,The Internet of Things (IoT) is revolutionizing industries by enabling connected devices to communicate and share data.
politics,Advocacy and activism are powerful tools for driving social change and holding governments and institutions accountable.
sports,Injuries are a reality of sports, but proper training, equipment, and medical care can help prevent and mitigate risks.
entertainment,Books transport readers to different worlds, allowing them to experience new adventures and perspectives.
health,Healthy lifestyle choices, such as regular exercise and balanced nutrition, are essential for preventing chronic diseases.
technology,Digital transformation is reshaping industries, economies, and societies, driven by advances in connectivity, computing, and data analytics.
politics,Political discourse should be respectful, constructive, and focused on finding solutions to shared challenges.
sports,The spirit of sportsmanship transcends borders and cultures, fostering mutual respect and understanding among nations.
entertainment,Art has the power to provoke thought, challenge norms, and inspire change in society.
health,Emotional well-being is as important as physical health, and seeking support and connection is vital for overall wellness.
technology,Emerging technologies such as augmented reality (AR) and virtual reality (VR) are transforming entertainment, education, and healthcare.
politics,Youth engagement in politics is critical for ensuring that the voices and concerns of future generations are heard and represented.
sports,The Olympic Games showcase the pinnacle of human athleticism, determination, and sportsmanship.
entertainment,Music transcends language and cultural barriers, bringing people together and sparking joy and connection.
health,Healthy aging involves maintaining physical, mental, and social well-being through lifestyle choices and supportive environments.
technology,The Fourth Industrial Revolution is characterized by the convergence of digital, physical, and biological technologies.
politics,Accountability and transparency are essential for effective governance and maintaining public trust in institutions.
sports,Sports fandom fosters a sense of belonging, identity, and community among fans worldwide.
entertainment,Artists challenge conventions, push boundaries, and inspire change through their creative expression.
health,Wellness encompasses physical, mental, and emotional well-being, requiring a holistic approach to health care and lifestyle choices.
technology,Cutting-edge innovations such as gene editing, quantum computing, and space exploration hold the potential to reshape the future.
politics,Inclusive and representative democracies ensure that all voices are heard and valued, fostering social cohesion and stability.
sports,The passion and dedication of sports fans create an electrifying atmosphere at stadiums and arenas around the world.
entertainment,The arts play a vital role in preserving cultural heritage, promoting diversity, and fostering creativity.
health,Self-care practices such as meditation, mindfulness, and self-reflection are essential for managing stress and promoting mental wellness.
technology,The digital divide exacerbates social and economic inequalities, highlighting the need for equitable access to technology and connectivity.
politics,Political polarization undermines democracy, hindering cooperation and compromise on pressing issues.
sports,The adrenaline rush of extreme sports challenges athletes to push their limits and embrace the thrill of adventure.
entertainment,The power of storytelling lies in its ability to educate, inspire, and ignite imagination in audiences.
health,Preventive health measures, such as vaccinations and screenings, are crucial for reducing the burden of disease and promoting public health.
