category,text
technology,Data privacy and security are paramount in the digital age, requiring robust safeguards and regulations to protect personal information.
politics,Effective governance relies on transparency, accountability, and public trust in institutions and leaders.
sports,The camaraderie and teamwork of sports unite people from diverse backgrounds, fostering mutual respect and understanding.
entertainment,Artists challenge norms, provoke thought, and inspire change through their creative expression.
health,Physical activity is essential for maintaining mobility, strength, and overall well-being as we age.
technology,Artificial intelligence (AI) is poised to revolutionize industries, from healthcare and finance to transportation and entertainment.
politics,Youth engagement in civic life is vital for shaping the future of democracy and driving positive social change.
sports,The spirit of sportsmanship emphasizes fair play, respect, and integrity on and off the field.
sports,The team demonstrated exceptional teamwork and determination throughout the season.
technology,Innovative solutions are driving advancements in various fields, from artificial intelligence to renewable energy.
politics,Public trust in government institutions is crucial for a stable and functioning democracy.
entertainment,The new movie release promises to be a blockbuster hit, with thrilling action sequences and stunning visual effects.
health,A balanced diet, regular exercise, and sufficient sleep are essential for maintaining overall well-being.
sports,The athlete's dedication to training and relentless pursuit of excellence have earned them numerous accolades.
technology,The rapid pace of technological innovation is reshaping industries and revolutionizing the way we live and work.
politics,Transparency and accountability are fundamental principles of good governance.
entertainment,The latest music album has topped the charts, captivating audiences with its catchy tunes and heartfelt lyrics.
health,Preventive healthcare measures, such as vaccination and screening programs, can significantly reduce the burden of disease.
sports,The championship game was a nail-biting showdown between two fiercely competitive teams.
technology,Artificial intelligence algorithms are being deployed to optimize business operations and improve decision-making processes.
politics,Political leaders must prioritize the needs of their constituents and work towards inclusive policies.
entertainment,The theater production received rave reviews from critics and audiences alike for its stellar performances.
health,Mental health awareness campaigns aim to reduce stigma and encourage open discussions about psychological well-being.
sports,The stadium erupted into cheers as the home team scored a last-minute goal to secure victory.
technology,The latest smartphone features cutting-edge technology, including facial recognition and augmented reality capabilities.
politics,International diplomacy plays a crucial role in resolving conflicts and promoting global cooperation.
entertainment,The art exhibition showcased a diverse range of artistic styles and creative expressions.
health,Regular medical check-ups are important for early detection of health issues and timely intervention.
sports,The athlete's perseverance in the face of adversity serves as an inspiration to aspiring athletes everywhere.
technology,Blockchain technology holds the potential to revolutionize industries such as finance, healthcare, and supply chain management.
politics,Civil liberties and human rights must be protected to ensure a free and democratic society.
entertainment,The blockbuster movie franchise continues to captivate audiences with its thrilling plot twists and stunning special effects.
health,Physical activity is essential for maintaining cardiovascular health and reducing the risk of chronic diseases.
sports,The championship victory was the culmination of months of hard work and dedication by the entire team.
technology,The Internet of Things (IoT) is transforming everyday objects into interconnected smart devices.
politics,Political polarization and partisan divides pose significant challenges to effective governance.
entertainment,The live concert drew a massive crowd of enthusiastic fans, who sang along to every song.
health,Dietary supplements should not be used as a substitute for a balanced diet and healthy lifestyle.
sports,The coach's strategic decisions proved to be instrumental in leading the team to victory.
technology,Advancements in renewable energy technologies are critical for combating climate change.
politics,Electoral reforms are necessary to ensure fair and transparent elections.
entertainment,The movie adaptation stayed true to the original book, delighting fans with its faithful portrayal of beloved characters.
health,Chronic stress can have adverse effects on both physical and mental health.
sports,The rivalry between the two teams dates back decades, adding extra intensity to every match.
technology,Data privacy concerns have prompted calls for stricter regulations on the collection and use of personal information.
politics,Political instability can undermine economic growth and social cohesion.
entertainment,The art installation sparked conversations about pressing social issues and cultural identity.
health,Sleep plays a crucial role in cognitive function, mood regulation, and overall health.
sports,The sportsmanship displayed by both teams was commendable, fostering a spirit of camaraderie and mutual respect.
technology,Virtual reality technology allows users to immerse themselves in realistic and interactive digital environments.
politics,Government corruption erodes public trust and undermines the rule of law.
entertainment,The Broadway musical received standing ovations for its mesmerizing performances and dazzling choreography.
health,Regular exercise can boost immune function and reduce the risk of chronic illnesses.
sports,The championship trophy represents the culmination of years of dedication and hard work.
technology,The rise of automation and artificial intelligence is reshaping the future of work.
politics,Diplomatic negotiations are underway to address regional conflicts and promote peace and stability.
entertainment,The film festival showcased a diverse selection of independent films from around the world.
health,Mental health disorders affect millions of people worldwide and require access to quality care and support services.
sports,The halftime show featured a spectacular performance by a world-renowned artist.
technology,Advances in biotechnology are revolutionizing healthcare and personalized medicine.
politics,Political polarization has led to gridlock in government and hindered progress on important issues.
entertainment,The novel adaptation received critical acclaim for its faithful depiction of the original story.
health,Adequate hydration is essential for maintaining optimal bodily functions and preventing dehydration.
sports,The coach's motivational pep talk inspired the team to give their all on the field.
technology,The era of 5G connectivity promises faster internet speeds and lower latency.
politics,Citizens have a civic duty to participate in democratic processes and hold elected officials accountable.
entertainment,The comedy series has become a cultural phenomenon, spawning memes and catchphrases.
health,Regular dental check-ups are important for maintaining oral health and preventing dental problems.
sports,The championship game drew a record-breaking audience, with millions tuning in to watch the action.
technology,Cutting-edge research in quantum computing has the potential to solve complex problems faster than ever before.
politics,Political campaigns rely heavily on social media platforms to reach voters and spread their message.
entertainment,The live performance received thunderous applause from the audience, who were captivated by the actor's riveting portrayal.
"health,Physical activity releases endorphins, which are known as ""feel-good"" hormones."
sports,The star athlete's retirement marks the end of an illustrious career spanning decades.
technology,The Internet has democratized access to information and empowered individuals to connect and collaborate globally.
politics,International cooperation is essential for addressing global challenges such as climate change and terrorism.
entertainment,The art exhibition featured works by emerging artists as well as established masters.
health,A balanced diet should include a variety of fruits, vegetables, whole grains, and lean proteins.
sports,The referee's controversial decision sparked heated debate among fans and pundits alike.
technology,Artificial intelligence algorithms are being used to analyze vast amounts of data and extract valuable insights.
politics,Public opinion polls provide valuable feedback on government performance and public sentiment.
entertainment,The movie premiere was a star-studded event attended by celebrities from around the world.
health,Regular physical activity can improve cardiovascular health and reduce the risk of heart disease.
sports,The team's victory parade drew thousands of fans who lined the streets to cheer them on.
technology,The development of self-driving cars is poised to revolutionize transportation and urban mobility.
politics,Political polarization has led to increased hostility and division within society.
entertainment,The musical performance received rave reviews for its captivating melodies and powerful lyrics.
health,Mental health awareness campaigns aim to reduce stigma and encourage people to seek help when needed.
sports,The coach's strategic decisions proved decisive in securing the team's victory.
technology,The advent of cloud computing has transformed the way businesses store, manage, and analyze data.
politics,The electorate's growing disillusionment with mainstream politicians has fueled support for alternative parties.
entertainment,The film adaptation of the bestselling novel was eagerly anticipated by fans.
health,Adequate sleep is essential for cognitive function, emotional well-being, and overall health.
sports,The team's remarkable comeback in the final minutes of the game stunned spectators.
technology,Advancements in biometric authentication technology are enhancing security measures across various industries.
politics,Political unrest and protests have rocked the nation, prompting calls for government reform.
entertainment,The art gallery showcased a diverse range of artistic styles and mediums.
health,Healthy lifestyle choices, such as regular exercise and a balanced diet, can help prevent chronic diseases.
sports,The star player's injury dealt a blow to the team's chances of winning the championship.
technology,The Internet of Things (IoT) ecosystem is expanding rapidly, connecting devices and enabling seamless automation.
politics,Public trust in government institutions has been eroded by corruption scandals and political infighting.
entertainment,The film director's bold vision and innovative storytelling techniques set the movie apart from its peers.
health,Practicing mindfulness meditation can help reduce stress and improve overall well-being.
sports,The team's relentless pursuit of victory earned them the admiration of fans and rivals alike.
technology,The digital revolution has transformed how we communicate, work, and interact with the world.
politics,Political candidates are using social media platforms to reach voters and mobilize support for their campaigns.
entertainment,The theater production received critical acclaim for its thought-provoking themes and powerful performances.
health,Physical exercise releases endorphins, which can boost mood and alleviate symptoms of depression.
sports,The championship match was a fierce battle between two evenly matched opponents.
technology,Advances in robotics and automation are reshaping industries and creating new opportunities for innovation.
politics,The rise of populism and nationalism has challenged traditional political norms and institutions.
entertainment,The art installation sparked conversations about identity, culture, and social justice.
health,Adequate sleep is essential for cognitive function, mood regulation, and overall well-being.
sports,The team's victory celebration lasted late into the night, with fans chanting and cheering in the streets.
technology,The development of renewable energy technologies is critical for combating climate change and reducing reliance on fossil fuels.
politics,Citizens have a responsibility to stay informed and actively participate in the democratic process.
entertainment,The film festival showcased a diverse array of films from around the world, representing different cultures and perspectives.
health,Regular exercise and a balanced diet are important for maintaining a healthy weight and reducing the risk of chronic diseases.
sports,The coach's halftime pep talk motivated the team to stage a comeback in the second half.
technology,Artificial intelligence has the potential to revolutionize industries such as healthcare, finance, and transportation.
politics,Political polarization has created gridlock in government, hindering progress on important policy issues.
entertainment,The theater production received rave reviews from critics and audiences alike for its compelling storytelling and dynamic performances.
health,Mental health awareness campaigns aim to reduce stigma and promote early intervention for mental health issues.
sports,The star athlete's retirement marked the end of an era in professional sports.
technology,The development of renewable energy technologies is crucial for addressing climate change and reducing carbon emissions.
politics,Political leaders must prioritize the needs of the people and work towards common goals for the betterment of society.
entertainment,The art exhibition featured works by emerging artists as well as established masters, showcasing a diverse range of artistic styles.
health,Practicing mindfulness meditation can help reduce stress and improve overall well-being.
sports,The team's victory
sports,The team showed remarkable resilience in the face of adversity, leading to a stunning comeback victory.
technology,Advancements in artificial intelligence are reshaping industries and opening new possibilities for innovation.
politics,Leadership requires a balance of vision, empathy, and decisiveness to navigate complex challenges.
entertainment,The film captivated audiences with its gripping storyline and stellar performances from the cast.
health,Physical activity is essential for maintaining overall well-being and reducing the risk of chronic diseases.
sports,The championship game was a nail-biter, with both teams giving it their all until the final buzzer.
technology,The latest breakthrough in renewable energy promises a more sustainable future for generations to come.
politics,Effective governance requires collaboration and compromise to address the diverse needs of society.
entertainment,The theater production received standing ovations for its breathtaking set design and talented cast.
health,A balanced diet rich in fruits, vegetables, and whole grains is key to supporting a healthy immune system.
sports,The star player's injury cast a shadow over the team's prospects for the remainder of the season.
technology,Blockchain technology has the potential to revolutionize the way we conduct financial transactions.
politics,Transparency and accountability are essential pillars of a functioning democracy.
entertainment,The music festival attracted thousands of fans, creating an electric atmosphere throughout the weekend.
health,Mental health awareness is on the rise, prompting conversations and initiatives to break the stigma.
sports,The underdog team defied expectations and emerged victorious against all odds.
technology,The era of autonomous vehicles is dawning, promising safer and more efficient transportation.
politics,Policy decisions must be guided by evidence and expertise to address complex societal issues.
entertainment,The art exhibition showcased a diverse range of talent, sparking thought-provoking conversations.
health,Regular exercise has been shown to improve mood and cognitive function in people of all ages.
sports,The game-winning goal in overtime sent the fans into a frenzy of celebration.
technology,The rise of big data analytics is enabling businesses to make more informed decisions.
politics,Civic engagement is essential for holding elected officials accountable and shaping public policy.
entertainment,The bestselling novel is set to be adapted into a major motion picture, generating buzz among fans.
health,Quality sleep is crucial for physical and mental health, allowing the body to repair and recharge.
sports,The coach's strategic decisions were instrumental in turning the team's fortunes around.
technology,Virtual reality technology is transforming industries ranging from gaming to education.
politics,International cooperation is needed to address global challenges such as climate change and poverty.
entertainment,The Broadway musical received rave reviews for its dazzling choreography and memorable songs.
health,Stress management techniques such as mindfulness and meditation can promote overall well-being.
sports,The rival teams faced off in a highly anticipated matchup with playoff implications.
technology,The Internet of Things is connecting devices and systems to create smarter, more efficient environments.
politics,Public trust in government institutions is essential for a healthy democracy.
entertainment,The actor's performance in the lead role earned widespread acclaim and award nominations.
health,Adequate hydration is important for regulating body temperature and supporting cellular function.
sports,The star athlete announced their retirement, marking the end of an illustrious career.
technology,Artificial intelligence algorithms are becoming increasingly sophisticated, raising ethical questions.
politics,Political discourse should be characterized by civility and respect for differing viewpoints.
entertainment,The television series finale left fans on the edge of their seats with its shocking twists.
health,Regular medical check-ups and screenings are vital for early detection and treatment of health conditions.
sports,The team's victory parade drew massive crowds of jubilant fans to the streets.
technology,Robotics technology is revolutionizing industries such as manufacturing and healthcare.
politics,Democratic norms and institutions must be safeguarded to uphold the rule of law.
entertainment,The film director's unique vision brought the story to life in a visually stunning way.
health,Healthy lifestyle choices, such as not smoking and limiting alcohol intake, can reduce the risk of disease.
sports,The rookie sensation burst onto the scene with a series of standout performances.
technology,Cloud computing services offer scalability and flexibility for businesses of all sizes.
politics,Electoral integrity is crucial for ensuring free and fair elections.
entertainment,The live concert was a sensory delight, with dazzling lights and electrifying music.
health,Emotional well-being is just as important as physical health for overall wellness.
sports,The championship game went into overtime, with both teams refusing to back down.
technology,Genetic engineering holds promise for breakthroughs in medicine and agriculture.
politics,Public discourse should be characterized by reasoned debate and mutual respect.
entertainment,The theater production received critical acclaim for its thought-provoking themes.
health,Adequate sleep is essential for cognitive function and emotional well-being.
sports,The star quarterback orchestrated a game-winning drive in the final minutes.
technology,The development of quantum computers could revolutionize computing power.
politics,Protecting human rights is a fundamental duty of governments worldwide.
entertainment,The art installation sparked conversations about identity and belonging.
health,Physical activity releases endorphins, which can improve mood and reduce stress.
sports,The team's dedication and teamwork were evident in their decisive victory.
technology,The advent of 5G technology promises faster and more reliable wireless connectivity.
politics,Engagement with diverse perspectives can lead to more effective policymaking.
entertainment,The film director's bold storytelling choices divided critics and audiences alike.
health,A balanced diet should include a variety of nutrient-rich foods for optimal health.
sports,The championship game came down to the wire, with a last-second shot deciding the outcome.
technology,The proliferation of social media has reshaped how information is shared and consumed.
politics,Political polarization has eroded trust in democratic institutions.
entertainment,The actor's portrayal of a complex character earned praise from critics.
health,Mental health challenges affect people of all ages and backgrounds.
sports,The coach's halftime pep talk inspired the team to stage a second-half comeback.
technology,Artificial intelligence applications are increasingly integrated into everyday life.
politics,The role of media literacy in combating misinformation is more important than ever.
entertainment,The music video went viral, garnering millions of views in just a few days.
health,Regular physical activity can reduce the risk of chronic diseases such as heart disease and diabetes.
sports,The referee's controversial call sparked debate among fans and analysts.
technology,Cybersecurity measures are essential for protecting sensitive data from cyber threats.
politics,Ensuring access to education and healthcare is a cornerstone of social equity.
entertainment,The author's latest novel explores themes of love, loss, and redemption.
health,Practicing good hygiene, such as washing hands regularly, can prevent the spread of illness.
sports,The team's winning streak came to an end with a disappointing loss in the final game.
technology,The potential of quantum computing to solve complex problems is unparalleled.
politics,Respect for the rule of law is essential for a functioning democracy.
entertainment,The film's ensemble cast delivered standout performances across the board.
health,Mental health resources and support services should be accessible to all individuals.
sports,The rivalry between the two teams dates back decades, adding extra intensity to their matchups.
technology,The Internet has transformed how we communicate, work, and access information.
politics,Political campaigns play a vital role in shaping public opinion and mobilizing voters.
entertainment,The art exhibit showcased a diverse array of styles and mediums.
health,Regular physical activity can boost energy levels and improve sleep quality.
sports,The team's star player set a new record for career points scored.
technology,Privacy concerns have prompted calls for greater regulation of social media platforms.
politics,The separation of powers ensures a system of checks and balances within government.
entertainment,The theater production received a standing ovation from the audience.
health,Self-care practices, such as mindfulness and relaxation techniques, can reduce stress.
sports,The coach's decision to switch up the lineup paid off with a decisive victory.
technology,The development of self-driving cars has the potential to revolutionize transportation.
politics,Political apathy can undermine the democratic process and lead to disenchantment with government.
entertainment,The film's stunning visuals and gripping storyline kept audiences on the edge of their seats.
health,Positive social connections and relationships are essential for mental and emotional well-being.
sports,The star athlete's retirement marked the end of an era in the world of sports.
technology,The rise of automation is reshaping industries and the future of work.
politics,Civic engagement is a fundamental right and responsibility of all citizens.
entertainment,The concert-goers were treated to an unforgettable performance by the legendary artist.
health,Managing stress is important for overall health and well-being.
sports,The team's victory parade through the city streets was a celebration for the ages.
technology,The Internet of Things is revolutionizing how we interact with our environment.
politics,Ensuring access to affordable housing is a key priority for policymakers.
entertainment,The film adaptation of the bestselling novel exceeded expectations at the box office.
health,Adequate sleep is essential for cognitive function and overall health.
sports,The championship game was a thrilling contest that kept fans on the edge of their seats.
technology,The development of renewable energy technologies is critical for combating climate change.
politics,Political polarization has led to increased gridlock and partisanship in government.
entertainment,The theater production received rave reviews for its innovative staging and powerful performances.
health,Regular physical activity can boost mood and improve mental well-being.
sports,The team's victory in the championship game was a testament to their hard work and dedication.
technology,The Internet has revolutionized how we access information and communicate with others.
politics,Electoral integrity is essential for upholding the legitimacy of democratic elections.
entertainment,The film's ensemble cast delivered standout performances that resonated with audiences.
