category,text
health,Practicing mindfulness and meditation can help reduce stress and improve overall well-being.
sports,The star player's injury cast doubt on the team's chances of winning the championship.
technology,Advancements in artificial intelligence have the potential to transform industries and societies.
politics,Public trust in government institutions is essential for a functioning democracy.
entertainment,The concert was a sold-out event, with fans eagerly anticipating the artist's performance.
health,Maintaining a balanced diet and regular exercise are key components of a healthy lifestyle.
sports,The team's victory was a testament to their skill, determination, and teamwork.
technology,The development of renewable energy sources is crucial for combating climate change.
politics,Political polarization has led to increased divisiveness and gridlock in government.
entertainment,The film's stunning visual effects and gripping storyline captivated audiences.
health,Emotional well-being is just as important as physical health for overall wellness.
sports,The championship game went into overtime, with both teams giving it their all until the final buzzer.
technology,The advent of 5G technology promises faster
sports,The team scored a last-minute goal to win the game.
technology,Advancements in artificial intelligence are reshaping industries.
politics,The government faces scrutiny over recent policy decisions.
entertainment,The film received mixed reviews from critics and audiences.
health,A healthy lifestyle includes regular exercise and nutritious meals.
sports,The athlete set a new world record in the 100-meter dash.
technology,New developments in renewable energy hold promise for the future.
politics,Political leaders debated the proposed budget in parliament.
entertainment,A popular TV series captivated viewers with its gripping storyline.
health,Experts warn of the dangers of excessive sugar consumption.
sports,The championship game ended in a thrilling overtime victory.
technology,The latest smartphone features a stunning OLED display.
politics,Voters turned out in record numbers for the national election.
entertainment,Celebrities attended the glamorous awards ceremony.
health,Medical professionals urge people to get enough sleep each night.
sports,The tennis match went into a tiebreaker in the final set.
technology,Virtual reality technology is transforming the gaming industry.
politics,The president signed a landmark trade agreement with neighboring countries.
entertainment,A blockbuster movie broke box office records.
health,Yoga and meditation are effective stress-relief techniques.
sports,The home team celebrated a hard-fought win with their fans.
technology,Artificial intelligence algorithms analyze vast amounts of data.
politics,Opposition parties criticized the government's handling of the crisis.
entertainment,A Broadway musical received rave reviews from theatergoers.
health,A balanced diet is essential for maintaining optimal health.
sports,The soccer match ended in a draw after a tense penalty shootout.
technology,Researchers are developing new treatments using gene-editing technology.
politics,Protesters took to the streets to demand political reforms.
entertainment,The concert sold out within minutes of tickets going on sale.
health,Regular physical activity reduces the risk of chronic diseases.
sports,The basketball team dominated their rivals in a lopsided victory.
technology,The latest software update introduces several new features.
politics,Legislators debated the controversial new bill in parliament.
entertainment,A popular band announced a reunion tour.
health,Eating a variety of fruits and vegetables boosts immunity.
sports,The marathon runner crossed the finish line in first place.
technology,Robotics technology is revolutionizing manufacturing processes.
politics,Diplomatic negotiations led to a historic peace agreement.
entertainment,A documentary film shed light on social issues.
health,Getting enough sleep is crucial for overall well-being.
sports,The golf tournament attracted top players from around the world.
technology,Blockchain technology is disrupting traditional finance.
politics,The prime minister delivered a televised address to the nation.
entertainment,A new art exhibition showcased the works of emerging artists.
health,Regular medical check-ups help detect health problems early.
sports,The cycling race tested riders' endurance and stamina.
technology,The company unveiled its latest innovation at a tech conference.
politics,The opposition leader called for a vote of no confidence.
entertainment,A Broadway play received critical acclaim from theater critics.
health,Staying hydrated is important for proper body function.
sports,The hockey team clinched victory with a dramatic overtime goal.
technology,Smart home devices are becoming increasingly popular.
politics,The president announced plans for infrastructure development.
entertainment,A music festival drew crowds from across the country.
health,Practicing good hygiene helps prevent the spread of disease.
sports,The rugby team won the championship for the third consecutive year.
technology,Researchers are working on breakthroughs in quantum computing.
politics,The mayor's reelection campaign gained momentum.
entertainment,A film adaptation of a bestselling novel hit theaters.
health,Healthy habits can improve quality of life and longevity.
sports,The swimmer set a new world record in the 200-meter freestyle.
technology,Self-driving cars promise to revolutionize transportation.
politics,Political analysts speculate about the outcome of the upcoming election.
entertainment,A comedian's stand-up special received rave reviews.
health,Adequate sleep is essential for cognitive function.
sports,The baseball team clinched a playoff berth with a win.
technology,Artificial intelligence systems learn from large datasets.
politics,The government announced tax cuts to stimulate the economy.
entertainment,An actor won an award for their performance in a movie.
health,Regular exercise strengthens muscles and bones.
sports,The football team rallied to win the game in overtime.
technology,The latest breakthrough in medical technology promises new treatments.
politics,Citizens protested against government corruption.
entertainment,A bestselling novel is being adapted into a TV series.
health,Eating a balanced diet supports overall health and well-being.
sports,The gymnast won gold at the international competition.
technology,Researchers are exploring the potential of quantum encryption.
politics,The prime minister faced tough questions from reporters.
entertainment,A popular band released a new album.
health,Mental health is just as important as physical health.
sports,The cycling race took participants through scenic routes.
technology,The latest software release fixes several bugs.
politics,Voters cast their ballots in the general election.
entertainment,A new art installation drew crowds to the museum.
health,Regular exercise improves cardiovascular health.
sports,The basketball team advanced to the finals.
technology,Virtual reality headsets provide immersive experiences.
politics,The opposition party called for a national referendum.
entertainment,A movie adaptation of a classic novel premiered.
health,Practicing mindfulness reduces stress levels.
sports,The soccer team suffered a defeat in the semifinals.
technology,Artificial intelligence algorithms analyze data patterns.
politics,The president signed legislation into law.
entertainment,A popular TV show returned for its final season.
health,Adequate hydration is important for overall health.
sports,The tennis player won the tournament trophy.
technology,The latest smartphone boasts advanced features.
politics,The opposition leader announced a plan for economic reform.
entertainment,A music video went viral on social media.
health,Eating a nutritious diet promotes well-being.
sports,The baseball pitcher threw a perfect game.
technology,The company announced a partnership with a major tech firm.
politics,Political candidates debated key issues in a televised forum.
entertainment,A new film festival showcased independent cinema.
health,Regular exercise boosts mood and energy levels.
sports,The hockey team secured a playoff spot.
technology,Advancements in biotechnology hold promise for medical breakthroughs.
politics,The president addressed the nation in a televised speech.
entertainment,A popular singer announced a world tour.
health,Adequate sleep is essential for physical and mental health.
sports,The football quarterback threw for over 400 yards.
technology,Researchers are developing AI-powered assistants.
politics,The opposition party proposed new legislation.
entertainment,A Broadway musical won multiple Tony Awards.
health,Healthy eating habits contribute to overall wellness.
sports,The golf tournament attracted top golfers from around the world.
technology,The latest gadget features innovative technology.
politics,Citizens protested against government corruption.
entertainment,A film adaptation of a bestselling novel premiered.
health,Eating a balanced diet supports overall health and well-being.
sports,The gymnast won gold at the international competition.
technology,Researchers are exploring the potential of quantum encryption.
politics,The prime minister faced tough questions from reporters.
entertainment,A popular band released a new album.
health,Mental health is just as important as physical health.
sports,The cycling race took participants through scenic routes.
technology,The latest software release fixes several bugs.
politics,Voters cast their ballots in the general election.
entertainment,A new art installation drew crowds to the museum.
health,Regular exercise improves cardiovascular health.
sports,The basketball team advanced to the finals.
technology,Virtual reality headsets provide immersive experiences.
politics,The opposition party called for a national referendum.
entertainment,A movie adaptation of a classic novel premiered.
health,Practicing mindfulness reduces stress levels.
sports,The soccer team suffered a defeat in the semifinals.
technology,Artificial intelligence algorithms analyze data patterns.
politics,The president signed legislation into law.
entertainment,A popular TV show returned for its final season.
health,Adequate hydration is important for overall health.
sports,The tennis player won the tournament trophy.
technology,The latest smartphone boasts advanced features.
politics,The opposition leader announced a plan for economic reform.
entertainment,A music video went viral on social media.
health,Eating a nutritious diet promotes well-being.
sports,The baseball pitcher threw a perfect game.
technology,The company announced a partnership with a major tech firm.
politics,Political candidates debated key issues in a televised forum.
entertainment,A new film festival showcased independent cinema.
health,Regular exercise boosts mood and energy levels.
sports,The hockey team secured a playoff spot.
technology,Advancements in biotechnology hold promise for medical breakthroughs.
politics,The president addressed the nation in a televised speech.
entertainment,A popular singer announced a world tour.
health,Adequate sleep is essential for physical and mental health.
sports,The football quarterback threw for over 400 yards.
technology,Researchers are developing AI-powered assistants.
politics,The opposition party proposed new legislation.
entertainment,A Broadway musical won multiple Tony Awards.
health,Healthy eating habits contribute to overall wellness.
sports,The marathon runner crossed the finish line in first place.
technology,Robotics technology is revolutionizing manufacturing processes.
politics,Diplomatic negotiations led to a historic peace agreement.
entertainment,A documentary film shed light on social issues.
health,Getting enough sleep is crucial for overall well-being.
sports,The basketball team dominated their rivals in a lopsided victory.
technology,The latest software update introduces several new features.
politics,Legislators debated the controversial new bill in parliament.
entertainment,A popular band announced a reunion tour.
health,Eating a variety of fruits and vegetables boosts immunity.
sports,The home team celebrated a hard-fought win with their fans.
technology,Artificial intelligence algorithms analyze vast amounts of data.
politics,Opposition parties criticized the government's handling of the crisis.
entertainment,A Broadway musical received rave reviews from theatergoers.
health,Medical professionals urge people to get enough sleep each night.
sports,The tennis match went into a tiebreaker in the final set.
technology,Virtual reality technology is transforming the gaming industry.
politics,The president signed a landmark trade agreement with neighboring countries.
entertainment,A blockbuster movie broke box office records.
health,Yoga and meditation are effective stress-relief techniques.
sports,The championship game ended in a thrilling overtime victory.
technology,The latest smartphone features a stunning OLED display.
politics,Voters turned out in record numbers for the national election.
entertainment,Celebrities attended the glamorous awards ceremony.
health,A balanced diet is essential for maintaining optimal health.
sports,The soccer match ended in a draw after a tense penalty shootout.
technology,Researchers are developing new treatments using gene-editing technology.
politics,Protesters took to the streets to demand political reforms.
entertainment,The concert sold out within minutes of tickets going on sale.
health,Regular physical activity reduces the risk of chronic diseases.
sports,The baseball team clinched victory with a dramatic overtime goal.
technology,The latest breakthrough in medical technology promises new treatments.
politics,Political leaders debated the proposed budget in parliament.
entertainment,A popular TV series captivated viewers with its gripping storyline.
health,Experts warn of the dangers of excessive sugar consumption.
sports,The athlete set a new world record in the 100-meter dash.
technology,New developments in renewable energy hold promise for the future.
politics,The government faces scrutiny over recent policy decisions.
entertainment,The film received mixed reviews from critics and audiences.
health,A healthy lifestyle includes regular exercise and nutritious meals.
sports,The team scored a last-minute goal to win the game.
technology,Advancements in artificial intelligence are reshaping industries.
politics,The mayor's reelection campaign gained momentum.
entertainment,A new art exhibition showcased the works of emerging artists.
health,Staying hydrated is important for proper body function.
sports,The cycling race tested riders' endurance and stamina.
technology,The company unveiled its latest innovation at a tech conference.
politics,The opposition leader called for a vote of no confidence.
entertainment,A comedy film drew laughs from audiences.
health,Regular exercise strengthens muscles and bones.
sports,The golf tournament attracted top players from around the world.
technology,Blockchain technology is disrupting traditional finance.
politics,The prime minister delivered a televised address to the nation.
entertainment,A bestselling author released a highly anticipated new novel.
health,Eating a balanced diet is essential for good health.
sports,The basketball player scored a career-high 40 points in the game.
technology,The latest gadget is equipped with state-of-the-art features.
politics,The opposition party unveiled its manifesto ahead of the election.
entertainment,A popular TV show was renewed for another season.
health,Physical activity is important for maintaining a healthy weight.
sports,The Olympic Games showcased athletes from around the world.
technology,The latest software update includes security enhancements.
politics,The president's approval rating saw a significant drop.
entertainment,A new movie trailer generated buzz online.
health,Regular exercise can improve mental well-being.
sports,The soccer team won the championship in a thrilling final match.
technology,Advancements in robotics are changing the way we work.
politics,The government announced new measures to tackle unemployment.
entertainment,A Broadway play received critical acclaim from theater critics.
health,Healthy eating habits are crucial for overall well-being.
sports,The baseball pitcher threw a perfect game.
technology,The latest smartphone boasts cutting-edge technology.
politics,The opposition party won a landslide victory in the election.
entertainment,A popular singer released a chart-topping album.
health,Maintaining a balanced diet is important for good health.
sports,The hockey team won the championship trophy.
technology,Artificial intelligence is revolutionizing various industries.
politics,Political tensions escalated between neighboring countries.
entertainment,A new Netflix series became a binge-watching sensation.
health,Regular exercise improves cardiovascular health.
sports,The basketball player was named MVP of the season.
technology,The latest tech conference showcased innovative products.
politics,The prime minister's speech sparked controversy.
entertainment,A blockbuster movie franchise announced a new installment.
health,Adequate sleep is essential for overall health and well-being.
sports,The tennis player won the Grand Slam title.
technology,Advancements in renewable energy are reducing carbon emissions.
politics,The opposition party called for an investigation into government corruption.
entertainment,A popular band released a greatest hits album.
health,Eating a balanced diet and staying active promote good health.
sports,The football team won the championship game in overtime.
technology,The latest software update fixed several bugs and glitches.
politics,Political unrest led to mass protests in the capital city.
entertainment,An acclaimed actor starred in a new Broadway production.
health,Regular physical activity is important for maintaining fitness.
sports,The baseball team clinched victory in a dramatic final inning.
technology,The latest breakthrough in medical science offers hope for patients.
politics,The president's approval ratings reached an all-time low.
entertainment,A highly anticipated film premiere attracted A-list celebrities.
health,A healthy lifestyle includes getting enough sleep each night.
sports,The soccer match ended in a draw after a thrilling penalty shootout.
technology,Innovations in artificial intelligence are transforming industries.
politics,The opposition leader called for a vote of confidence in the government.
entertainment,A popular TV show returned for its final season.
health,A balanced diet and regular exercise are keys to good health.
sports,The basketball team won the championship with a buzzer-beater shot.
technology,The latest smartphone features advanced facial recognition technology.
politics,The prime minister's speech was met with criticism from opposition parties.
entertainment,A new movie adaptation of a bestselling novel premiered.
health,Practicing mindfulness meditation can reduce stress levels.
sports,The hockey team secured a playoff spot with a win in the final game.
technology,Artificial intelligence is revolutionizing the healthcare industry.
politics,Voters turned out in record numbers for the national election.
entertainment,A popular band announced a world tour.
health,Adequate sleep is essential for physical and mental well-being.
sports,The football quarterback threw for over 400 yards in the game.
technology,Researchers are developing AI-powered virtual assistants.
politics,The opposition party proposed new legislation in parliament.
entertainment,A Broadway musical won multiple Tony Awards.
health,Healthy eating habits contribute to overall wellness and vitality.
sports,The golf tournament attracted top players from around the world.
technology,The latest gadget features innovative technology and design.
politics,Citizens protested against government corruption and injustice.
entertainment,A film adaptation of a classic novel premiered in theaters.
health,Eating a nutritious diet promotes well-being and longevity.
sports,The gymnast won gold at the international competition.
technology,Researchers are exploring the potential of quantum computing.
politics,The prime minister faced tough questions from reporters at a press conference.
entertainment,A popular singer released a new album.
health,Adequate hydration is important for overall health and well-being.
sports,The tennis player won the tournament championship.
technology,The latest smartphone boasts cutting-edge features and performance.
politics,The opposition leader announced a plan for economic reform.
entertainment,A music video went viral on social media platforms.
health,Eating a balanced diet is essential for maintaining good health.
sports,The baseball pitcher threw a perfect game for his team.
technology,Artificial intelligence algorithms analyze data to make predictions.
politics,The president signed important legislation into law.
entertainment,A popular TV show returned for its final season.
health,Adequate sleep is crucial for physical and mental health.
sports,The soccer team suffered a defeat in the semifinals.
technology,The latest software release fixes several bugs and vulnerabilities.
politics,Voters cast their ballots in the general election.
entertainment,A new art installation drew crowds to the museum.
health,Regular exercise improves cardiovascular fitness and overall health.
sports,The basketball team advanced to the finals of the tournament.
technology,Virtual reality headsets provide immersive gaming experiences.
politics,The opposition party called for a national referendum on the issue.
entertainment,A new movie adaptation of a bestselling novel premiered in theaters.
health,Practicing mindfulness meditation can reduce stress and anxiety levels.
sports,The baseball team won the championship series in a decisive game.
technology,The latest smartphone features a high-resolution display and fast processor.
politics,The prime minister announced plans for economic stimulus measures.
entertainment,A popular band released a new single from their upcoming album.
health,Eating a balanced diet and getting regular exercise are essential for good health.
sports,The football team scored a last-minute touchdown to win the game.
technology,Researchers are developing new technologies to combat climate change.
politics,The opposition party accused the government of corruption.
entertainment,A highly anticipated movie premiere drew crowds of fans.
health,Regular physical activity improves overall fitness and well-being.
sports,The soccer team advanced to the final round of the tournament.
technology,The latest software update includes improved security features.
politics,The president's approval ratings have declined in recent months.
entertainment,A popular TV series returned for its latest season.
health,Adequate sleep is important for cognitive function and mood regulation.
sports,The basketball player scored a career-high 50 points in the game.
technology,Advancements in artificial intelligence are reshaping industries worldwide.
politics,Political leaders debated the budget proposal in parliament.
entertainment,An acclaimed actor starred in a new blockbuster movie.
health,Eating a balanced diet and exercising regularly are keys to a healthy lifestyle.
sports,The hockey team won the championship title in overtime.
technology,The latest tech conference showcased cutting-edge innovations in robotics.
politics,The opposition party called for a vote of confidence in the government.
entertainment,A popular singer released a new album that topped the charts.
health,Adequate hydration is essential for overall health and well-being.
sports,The tennis player won the Grand Slam tournament for the third time.
technology,The latest smartphone boasts advanced features and functionality.
politics,The prime minister's speech was met with criticism from opposition parties.
entertainment,A highly anticipated film premiere attracted A-list celebrities.
health,Regular exercise and a balanced diet are important for maintaining good health.
sports,The baseball team clinched victory in the final inning of the game.
technology,The latest breakthrough in medical science offers hope for patients with rare diseases.
politics,The president's approval ratings reached an all-time low.
entertainment,A popular TV show returned for its final season with record-breaking ratings.
health,Adequate sleep is crucial for physical and mental well-being.
sports,The soccer match ended in a draw after a thrilling penalty shootout.
technology,Advancements in artificial intelligence are transforming industries.
politics,The opposition leader called for a vote of confidence in the government.
entertainment,A popular band released a greatest hits album.
health,Eating a balanced diet and staying active promote good health.
sports,The football team won the championship game in overtime.
technology,The latest software update fixed several bugs and glitches.
sports,The marathon runner crossed the finish line in first place.
technology,Researchers are working on breakthroughs in quantum computing.
politics,Protesters took to the streets to demand political reforms.
entertainment,A documentary film shed light on social issues.
health,Getting enough sleep is crucial for overall well-being.
